{
  "$schema": "https://json-schema.org/draft/2020-12/schema",
  "$id": "https://github.com/asinugobi/ai-ecosystem-explorer/data/schema/links.schema.json",
  "title": "AI Ecosystem Link (relationship)",
  "description": "Directed company-to-company relationships. This is the layer Hudson Labs' Sankey structurally cannot render, and the reason this project exists.",
  "type": "array",
  "items": {
    "type": "object",
    "required": [
      "id",
      "source",
      "target",
      "type",
      "description"
    ],
    "additionalProperties": false,
    "properties": {
      "id": {
        "type": "string",
        "pattern": "^[a-z0-9][a-z0-9_-]*$"
      },
      "source": {
        "type": "string",
        "description": "Node id. Direction is source -> target, read as 'source provides/commits to target'. D3 mutates this into an object reference at runtime \u2014 never persist a settled graph."
      },
      "target": {
        "type": "string",
        "description": "Node id."
      },
      "type": {
        "type": "string",
        "enum": [
          "investment",
          "equity_stake",
          "corporate_venture",
          "compute_contract",
          "compute_for_equity",
          "compute_credits",
          "supply",
          "foundry",
          "power_purchase",
          "data_license",
          "partnership",
          "customer_concentration",
          "operational_integration"
        ],
        "description": "Three tiers. CAPITAL FLOW: investment, equity_stake, corporate_venture. SUBSIDIZED COMPUTE: compute_contract, compute_for_equity, compute_credits \u2014 in-kind or equity-linked compute is the mechanism behind most apparent AI-native gross margin. OPERATIONAL: supply, foundry, power_purchase, data_license, partnership, customer_concentration, operational_integration."
      },
      "value_usd_m": {
        "type": [
          "number",
          "null"
        ],
        "description": "Disclosed deal value in USD millions. Null when undisclosed \u2014 link renders dashed."
      },
      "announced": {
        "type": [
          "string",
          "null"
        ],
        "format": "date"
      },
      "term": {
        "type": [
          "string",
          "null"
        ],
        "description": "e.g. '5 years', 'multi-year', 'through 2030'."
      },
      "description": {
        "type": "string",
        "minLength": 20
      },
      "is_estimate": {
        "type": "boolean",
        "default": false
      },
      "updated_at": {
        "type": "string",
        "format": "date"
      },
      "updated_by": {
        "type": "string",
        "enum": [
          "seed",
          "agent_pipeline",
          "manual"
        ],
        "default": "seed"
      },
      "pct_of_source_revenue": {
        "type": [
          "number",
          "null"
        ],
        "description": "What share of SOURCE's revenue this relationship represents. Customer concentration risk. e.g. Microsoft was ~60%+ of CoreWeave revenue."
      },
      "pct_of_target_cogs": {
        "type": [
          "number",
          "null"
        ],
        "description": "What share of TARGET's cost base this represents. Supplier dependency."
      },
      "exposure_note": {
        "type": "string",
        "description": "Read-across: what happens to each side if this relationship changes."
      },
      "citation": {
        "$ref": "#/$defs/citation",
        "description": "Provenance for the relationship. Named `citation` because `source` is the D3 edge endpoint."
      },
      "in_kind": {
        "type": [
          "boolean",
          "null"
        ],
        "description": "True when consideration is credits or equity rather than cash. Compute-for-equity flatters the recipient's margin and the provider's revenue simultaneously."
      }
    }
  },
  "$defs": {
    "citation": {
      "type": "object",
      "description": "Provenance for a single figure. Required whenever a value is present.",
      "required": [
        "publisher",
        "url",
        "as_of"
      ],
      "additionalProperties": false,
      "properties": {
        "publisher": {
          "type": "string",
          "description": "e.g. 'NVIDIA Q2 FY2026 10-Q', 'The Information'"
        },
        "title": {
          "type": "string"
        },
        "url": {
          "type": "string",
          "format": "uri"
        },
        "as_of": {
          "type": "string",
          "format": "date",
          "description": "Date the figure was reported, not the date scraped."
        },
        "quote": {
          "type": "string",
          "maxLength": 300,
          "description": "Short supporting excerpt. Keep under 300 chars."
        }
      }
    }
  }
}
